{
  "$schema": "http://json-schema.org/draft-07/schema#",
  "title": "Collection Manifest",
  "description": "Schema for awesome-copilot collection manifest files",
  "type": "object",
  "required": ["id", "name", "description", "items"],
  "additionalProperties": false,
  "properties": {
    "id": {
      "type": "string",
      "description": "Unique identifier for the collection",
      "pattern": "^[a-z0-9-]+$",
      "minLength": 1,
      "maxLength": 50
    },
    "name": {
      "type": "string",
      "description": "Display name for the collection",
      "minLength": 1,
      "maxLength": 100
    },
    "description": {
      "type": "string",
      "description": "Description of what this collection contains",
      "minLength": 1,
      "maxLength": 500
    },
    "tags": {
      "type": "array",
      "description": "Optional tags for discovery",
      "items": {
        "type": "string",
        "pattern": "^[a-z0-9-]+$",
        "minLength": 1,
        "maxLength": 30
      },
      "uniqueItems": true,
      "maxItems": 10
    },
    "items": {
      "type": "array",
      "description": "List of items in this collection",
      "minItems": 1,
      "maxItems": 50,
      "items": {
        "type": "object",
        "required": ["path", "kind"],
        "additionalProperties": false,
        "properties": {
          "path": {
            "type": "string",
            "description": "Relative path from repository root to the item file",
            "pattern": "^(?:\\.agents/skills/[^/]+/SKILL\\.md|skills/[^/]+/SKILL\\.md|(prompts|instructions|agents)/[^/]+\\.(prompt|instructions|agent)\\.md)$",
            "minLength": 1
          },
          "kind": {
            "type": "string",
            "description": "Type of the item",
            "enum": ["prompt", "instruction", "agent", "skill"]
          },
          "usage": {
            "type": "string",
            "description": "Optional usage context for the item"
          },
          "role": {
            "type": "string",
            "description": "Optional parallel-agent role label for orchestration"
          },
          "lean_ctx": {
            "type": "object",
            "description": "Optional lean-ctx A2A / intelligence metadata",
            "additionalProperties": false,
            "properties": {
              "agent_type": { "type": "string" },
              "a2a_role": { "type": "string" },
              "protocols": {
                "type": "array",
                "items": { "type": "string" }
              },
              "intelligence_tools": {
                "type": "array",
                "items": { "type": "string" }
              },
              "preload_profile": { "type": "string" }
            }
          }
        }
      },
      "uniqueItems": true
    },
    "display": {
      "type": "object",
      "description": "Optional display settings for the collection",
      "additionalProperties": false,
      "properties": {
        "ordering": {
          "type": "string",
          "description": "How to order items in the collection",
          "enum": ["manual", "alpha"],
          "default": "alpha"
        },
        "show_badge": {
          "type": "boolean",
          "description": "Whether to show collection badge on items",
          "default": false
        },
        "featured": {
          "type": "boolean",
          "description": "Whether this collection is featured on the main page",
          "default": false
        }
      }
    }
  }
}
